PCT测试结果 - 第1轮
测试开始时间: 2026-02-02 17:10:29
SSD路径: /dev/nvme1n1
SSD SN: 202505202T9005
SSD链路状态: LnkSta:	Speed 8GT/s, Width x4

============================================================
SMART信息:
============================================================
Smart Log for NVME device:nvme1n1 namespace-id:ffffffff
critical_warning			: 0
temperature				: 34 °C (307 K, 93 °F)
available_spare				: 100%
available_spare_threshold		: 10%
percentage_used				: 0%
endurance group critical warning summary: 0
Data Units Read				: 13952974 (7.14 TB)
Data Units Written			: 14930488 (7.64 TB)
host_read_commands			: 74834237
host_write_commands			: 78633816
controller_busy_time			: 874
power_cycles				: 222
power_on_hours				: 153
unsafe_shutdowns			: 11
media_errors				: 0
num_err_log_entries			: 0
Warning Temperature Time		: 0
Critical Composite Temperature Time	: 0
Temperature Sensor 1			: 34 °C (307 K, 93 °F)
Temperature Sensor 2			: 34 °C (307 K, 93 °F)
Temperature Sensor 4			: 42 °C (315 K, 107 °F)
Temperature Sensor 5			: 123 °C (396 K, 253 °F)
Thermal Management T1 Trans Count	: 0
Thermal Management T2 Trans Count	: 0
Thermal Management T1 Total Time	: 65536
Thermal Management T2 Total Time	: 65537


============================================================
FIO执行命令: fio --ioengine=libaio --bs=1M --iodepth=128 --numjobs=1 --direct=1 --name=test --rw=write --filename=/dev/nvme1n1 --verify=crc32c --do_verify=1 --group_reporting --size=1G

============================================================
FIO输出:
============================================================
test: (g=0): rw=write, bs=(R) 1024KiB-1024KiB, (W) 1024KiB-1024KiB, (T) 1024KiB-1024KiB, ioengine=libaio, iodepth=128
fio-3.36
Starting 1 process

test: (groupid=0, jobs=1): err= 0: pid=34085: Mon Feb  2 04:10:46 2026
  read: IOPS=2645, BW=2646MiB/s (2775MB/s)(1024MiB/387msec)
    slat (nsec): min=4884, max=47055, avg=9011.02, stdev=3188.44
    clat (usec): min=1211, max=87237, avg=46249.98, stdev=13708.48
     lat (usec): min=1235, max=87253, avg=46258.99, stdev=13708.72
    clat percentiles (usec):
     |  1.00th=[ 5145],  5.00th=[18744], 10.00th=[35914], 20.00th=[43779],
     | 30.00th=[43779], 40.00th=[43779], 50.00th=[43779], 60.00th=[43779],
     | 70.00th=[44303], 80.00th=[58983], 90.00th=[62129], 95.00th=[69731],
     | 99.00th=[83362], 99.50th=[85459], 99.90th=[86508], 99.95th=[87557],
     | 99.99th=[87557]
  write: IOPS=1410, BW=1410MiB/s (1479MB/s)(1024MiB/726msec); 0 zone resets
    slat (usec): min=217, max=4270, avg=298.69, stdev=132.20
    clat (msec): min=43, max=168, avg=87.74, stdev=21.93
     lat (msec): min=43, max=168, avg=88.04, stdev=21.91
    clat percentiles (msec):
     |  1.00th=[   44],  5.00th=[   46], 10.00th=[   53], 20.00th=[   85],
     | 30.00th=[   87], 40.00th=[   89], 50.00th=[   90], 60.00th=[   90],
     | 70.00th=[   91], 80.00th=[   94], 90.00th=[  100], 95.00th=[  134],
     | 99.00th=[  163], 99.50th=[  165], 99.90th=[  169], 99.95th=[  169],
     | 99.99th=[  169]
   bw (  KiB/s): min=694272, max=1400079, per=72.50%, avg=1047175.50, stdev=499080.92, samples=2
   iops        : min=  678, max= 1367, avg=1022.50, stdev=487.20, samples=2
  lat (msec)   : 2=0.10%, 4=0.24%, 10=0.93%, 20=1.46%, 50=40.28%
  lat (msec)   : 100=52.05%, 250=4.93%
  cpu          : usr=39.60%, sys=1.26%, ctx=1698, majf=0, minf=41
  IO depths    : 1=0.1%, 2=0.2%, 4=0.4%, 8=0.8%, 16=1.6%, 32=3.1%, >=64=93.8%
     submit    : 0=0.0%, 4=100.0%, 8=0.0%, 16=0.0%, 32=0.0%, 64=0.0%, >=64=0.0%
     complete  : 0=0.0%, 4=99.9%, 8=0.0%, 16=0.0%, 32=0.0%, 64=0.0%, >=64=0.1%
     issued rwts: total=1024,1024,0,0 short=0,0,0,0 dropped=0,0,0,0
     latency   : target=0, window=0, percentile=100.00%, depth=128

Run status group 0 (all jobs):
   READ: bw=2646MiB/s (2775MB/s), 2646MiB/s-2646MiB/s (2775MB/s-2775MB/s), io=1024MiB (1074MB), run=387-387msec
  WRITE: bw=1410MiB/s (1479MB/s), 1410MiB/s-1410MiB/s (1479MB/s-1479MB/s), io=1024MiB (1074MB), run=726-726msec

Disk stats (read/write):
  nvme1n1: ios=8293/8192, sectors=2101352/2097152, merge=0/0, ticks=354898/660965, in_queue=1015864, util=88.53%

PCT测试结果 - 第2轮
测试开始时间: 2026-02-02 17:11:31
SSD路径: /dev/nvme1n1
SSD SN: 202505202T9005
SSD链路状态: LnkSta:	Speed 8GT/s, Width x4

============================================================
SMART信息:
============================================================
Smart Log for NVME device:nvme1n1 namespace-id:ffffffff
critical_warning			: 0
temperature				: 34 °C (307 K, 93 °F)
available_spare				: 100%
available_spare_threshold		: 10%
percentage_used				: 0%
endurance group critical warning summary: 0
Data Units Read				: 13955082 (7.15 TB)
Data Units Written			: 14932585 (7.65 TB)
host_read_commands			: 74842692
host_write_commands			: 78642008
controller_busy_time			: 874
power_cycles				: 223
power_on_hours				: 153
unsafe_shutdowns			: 11
media_errors				: 0
num_err_log_entries			: 0
Warning Temperature Time		: 0
Critical Composite Temperature Time	: 0
Temperature Sensor 1			: 34 °C (307 K, 93 °F)
Temperature Sensor 2			: 35 °C (308 K, 95 °F)
Temperature Sensor 4			: 43 °C (316 K, 109 °F)
Temperature Sensor 5			: 123 °C (396 K, 253 °F)
Thermal Management T1 Trans Count	: 0
Thermal Management T2 Trans Count	: 0
Thermal Management T1 Total Time	: 65536
Thermal Management T2 Total Time	: 65537


============================================================
FIO执行命令: fio --ioengine=libaio --bs=1M --iodepth=128 --numjobs=1 --direct=1 --name=test --rw=write --filename=/dev/nvme1n1 --verify=crc32c --do_verify=1 --group_reporting --size=1G

============================================================
FIO输出:
============================================================
test: (g=0): rw=write, bs=(R) 1024KiB-1024KiB, (W) 1024KiB-1024KiB, (T) 1024KiB-1024KiB, ioengine=libaio, iodepth=128
fio-3.36
Starting 1 process

test: (groupid=0, jobs=1): err= 0: pid=33873: Mon Feb  2 04:11:47 2026
  read: IOPS=2515, BW=2516MiB/s (2638MB/s)(1024MiB/407msec)
    slat (nsec): min=4941, max=28123, avg=7978.26, stdev=2505.38
    clat (usec): min=1211, max=110499, avg=48765.23, stdev=23943.54
     lat (usec): min=1220, max=110510, avg=48773.20, stdev=23943.52
    clat percentiles (msec):
     |  1.00th=[    5],  5.00th=[   11], 10.00th=[   17], 20.00th=[   28],
     | 30.00th=[   41], 40.00th=[   45], 50.00th=[   48], 60.00th=[   49],
     | 70.00th=[   57], 80.00th=[   71], 90.00th=[   85], 95.00th=[   91],
     | 99.00th=[  107], 99.50th=[  109], 99.90th=[  110], 99.95th=[  111],
     | 99.99th=[  111]
  write: IOPS=1380, BW=1380MiB/s (1447MB/s)(1024MiB/742msec); 0 zone resets
    slat (usec): min=216, max=430, avg=292.20, stdev=44.96
    clat (usec): min=1699, max=231112, avg=89566.61, stdev=36442.16
     lat (usec): min=1962, max=231352, avg=89858.81, stdev=36427.09
    clat percentiles (msec):
     |  1.00th=[    9],  5.00th=[   41], 10.00th=[   45], 20.00th=[   72],
     | 30.00th=[   88], 40.00th=[   90], 50.00th=[   90], 60.00th=[   90],
     | 70.00th=[   90], 80.00th=[   92], 90.00th=[  124], 95.00th=[  142],
     | 99.00th=[  226], 99.50th=[  228], 99.90th=[  230], 99.95th=[  232],
     | 99.99th=[  232]
   bw (  KiB/s): min=718848, max=1378304, per=74.20%, avg=1048576.00, stdev=466305.81, samples=2
   iops        : min=  702, max= 1346, avg=1024.00, stdev=455.38, samples=2
  lat (msec)   : 2=0.15%, 4=0.54%, 10=2.15%, 20=5.27%, 50=31.59%
  lat (msec)   : 100=51.03%, 250=9.28%
  cpu          : usr=36.67%, sys=2.00%, ctx=1520, majf=0, minf=39
  IO depths    : 1=0.1%, 2=0.2%, 4=0.4%, 8=0.8%, 16=1.6%, 32=3.1%, >=64=93.8%
     submit    : 0=0.0%, 4=100.0%, 8=0.0%, 16=0.0%, 32=0.0%, 64=0.0%, >=64=0.0%
     complete  : 0=0.0%, 4=99.9%, 8=0.0%, 16=0.0%, 32=0.0%, 64=0.0%, >=64=0.1%
     issued rwts: total=1024,1024,0,0 short=0,0,0,0 dropped=0,0,0,0
     latency   : target=0, window=0, percentile=100.00%, depth=128

Run status group 0 (all jobs):
   READ: bw=2516MiB/s (2638MB/s), 2516MiB/s-2516MiB/s (2638MB/s-2638MB/s), io=1024MiB (1074MB), run=407-407msec
  WRITE: bw=1380MiB/s (1447MB/s), 1380MiB/s-1380MiB/s (1447MB/s-1447MB/s), io=1024MiB (1074MB), run=742-742msec

Disk stats (read/write):
  nvme1n1: ios=7948/8192, sectors=2013032/2097152, merge=0/0, ticks=357234/678592, in_queue=1035827, util=90.06%

PCT测试结果 - 第3轮
测试开始时间: 2026-02-02 17:12:32
SSD路径: /dev/nvme1n1
SSD SN: 202505202T9005
SSD链路状态: LnkSta:	Speed 8GT/s, Width x4

============================================================
SMART信息:
============================================================
Smart Log for NVME device:nvme1n1 namespace-id:ffffffff
critical_warning			: 0
temperature				: 34 °C (307 K, 93 °F)
available_spare				: 100%
available_spare_threshold		: 10%
percentage_used				: 0%
endurance group critical warning summary: 0
Data Units Read				: 13957190 (7.15 TB)
Data Units Written			: 14934682 (7.65 TB)
host_read_commands			: 74851146
host_write_commands			: 78650200
controller_busy_time			: 874
power_cycles				: 224
power_on_hours				: 153
unsafe_shutdowns			: 11
media_errors				: 0
num_err_log_entries			: 0
Warning Temperature Time		: 0
Critical Composite Temperature Time	: 0
Temperature Sensor 1			: 34 °C (307 K, 93 °F)
Temperature Sensor 2			: 35 °C (308 K, 95 °F)
Temperature Sensor 4			: 43 °C (316 K, 109 °F)
Temperature Sensor 5			: 123 °C (396 K, 253 °F)
Thermal Management T1 Trans Count	: 0
Thermal Management T2 Trans Count	: 0
Thermal Management T1 Total Time	: 65536
Thermal Management T2 Total Time	: 65537


============================================================
FIO执行命令: fio --ioengine=libaio --bs=1M --iodepth=128 --numjobs=1 --direct=1 --name=test --rw=write --filename=/dev/nvme1n1 --verify=crc32c --do_verify=1 --group_reporting --size=1G

============================================================
FIO输出:
============================================================
test: (g=0): rw=write, bs=(R) 1024KiB-1024KiB, (W) 1024KiB-1024KiB, (T) 1024KiB-1024KiB, ioengine=libaio, iodepth=128
fio-3.36
Starting 1 process

test: (groupid=0, jobs=1): err= 0: pid=33884: Mon Feb  2 04:12:49 2026
  read: IOPS=2515, BW=2516MiB/s (2638MB/s)(1024MiB/407msec)
    slat (nsec): min=4697, max=28627, avg=7949.47, stdev=2315.30
    clat (usec): min=1221, max=110561, avg=48705.06, stdev=25274.89
     lat (usec): min=1233, max=110571, avg=48713.01, stdev=25275.11
    clat percentiles (msec):
     |  1.00th=[    5],  5.00th=[   11], 10.00th=[   15], 20.00th=[   25],
     | 30.00th=[   36], 40.00th=[   44], 50.00th=[   47], 60.00th=[   50],
     | 70.00th=[   60], 80.00th=[   71], 90.00th=[   86], 95.00th=[   96],
     | 99.00th=[  108], 99.50th=[  110], 99.90th=[  111], 99.95th=[  111],
     | 99.99th=[  111]
  write: IOPS=1408, BW=1409MiB/s (1477MB/s)(1024MiB/727msec); 0 zone resets
    slat (usec): min=206, max=4268, avg=302.38, stdev=133.14
    clat (usec): min=1487, max=181398, avg=87603.92, stdev=26372.43
     lat (usec): min=1900, max=181640, avg=87906.29, stdev=26356.80
    clat percentiles (msec):
     |  1.00th=[    5],  5.00th=[   47], 10.00th=[   47], 20.00th=[   81],
     | 30.00th=[   89], 40.00th=[   90], 50.00th=[   90], 60.00th=[   90],
     | 70.00th=[   91], 80.00th=[   94], 90.00th=[  108], 95.00th=[  142],
     | 99.00th=[  171], 99.50th=[  174], 99.90th=[  182], 99.95th=[  182],
     | 99.99th=[  182]
   bw (  KiB/s): min=698368, max=1398784, per=72.70%, avg=1048576.00, stdev=495268.90, samples=2
   iops        : min=  682, max= 1366, avg=1024.00, stdev=483.66, samples=2
  lat (msec)   : 2=0.20%, 4=0.68%, 10=2.44%, 20=5.03%, 50=28.91%
  lat (msec)   : 100=55.42%, 250=7.32%
  cpu          : usr=38.87%, sys=1.15%, ctx=1469, majf=0, minf=40
  IO depths    : 1=0.1%, 2=0.2%, 4=0.4%, 8=0.8%, 16=1.6%, 32=3.1%, >=64=93.8%
     submit    : 0=0.0%, 4=100.0%, 8=0.0%, 16=0.0%, 32=0.0%, 64=0.0%, >=64=0.0%
     complete  : 0=0.0%, 4=99.9%, 8=0.0%, 16=0.0%, 32=0.0%, 64=0.0%, >=64=0.1%
     issued rwts: total=1024,1024,0,0 short=0,0,0,0 dropped=0,0,0,0
     latency   : target=0, window=0, percentile=100.00%, depth=128

Run status group 0 (all jobs):
   READ: bw=2516MiB/s (2638MB/s), 2516MiB/s-2516MiB/s (2638MB/s-2638MB/s), io=1024MiB (1074MB), run=407-407msec
  WRITE: bw=1409MiB/s (1477MB/s), 1409MiB/s-1409MiB/s (1477MB/s-1477MB/s), io=1024MiB (1074MB), run=727-727msec

Disk stats (read/write):
  nvme1n1: ios=8266/8192, sectors=2094440/2097152, merge=0/0, ticks=372298/658220, in_queue=1030519, util=90.06%

