PCT测试结果 - 第1轮
测试开始时间: 2026-02-02 17:10:29
SSD路径: /dev/nvme0n1
SSD SN: 202505202T9002
SSD链路状态: LnkSta:	Speed 8GT/s, Width x4

============================================================
SMART信息:
============================================================
Smart Log for NVME device:nvme0n1 namespace-id:ffffffff
critical_warning			: 0
temperature				: 24 °C (297 K, 75 °F)
available_spare				: 100%
available_spare_threshold		: 10%
percentage_used				: 1%
endurance group critical warning summary: 0
Data Units Read				: 42807236 (21.92 TB)
Data Units Written			: 61851275 (31.67 TB)
host_read_commands			: 380511283
host_write_commands			: 482451310
controller_busy_time			: 399
power_cycles				: 569
power_on_hours				: 59
unsafe_shutdowns			: 139
media_errors				: 0
num_err_log_entries			: 0
Warning Temperature Time		: 0
Critical Composite Temperature Time	: 0
Temperature Sensor 1			: 24 °C (297 K, 75 °F)
Temperature Sensor 2			: 24 °C (297 K, 75 °F)
Temperature Sensor 4			: 33 °C (306 K, 91 °F)
Temperature Sensor 5			: 115 °C (388 K, 239 °F)
Thermal Management T1 Trans Count	: 0
Thermal Management T2 Trans Count	: 0
Thermal Management T1 Total Time	: 131072
Thermal Management T2 Total Time	: 11667856


============================================================
FIO执行命令: fio --ioengine=libaio --bs=1M --iodepth=128 --numjobs=1 --direct=1 --name=test --rw=write --filename=/dev/nvme0n1 --verify=crc32c --do_verify=1 --group_reporting --size=1G

============================================================
FIO输出:
============================================================
test: (g=0): rw=write, bs=(R) 1024KiB-1024KiB, (W) 1024KiB-1024KiB, (T) 1024KiB-1024KiB, ioengine=libaio, iodepth=128
fio-3.36
Starting 1 process

test: (groupid=0, jobs=1): err= 0: pid=34084: Mon Feb  2 04:10:45 2026
  read: IOPS=2687, BW=2688MiB/s (2818MB/s)(1024MiB/381msec)
    slat (usec): min=5, max=350, avg= 8.23, stdev=11.14
    clat (usec): min=1542, max=122799, avg=45020.68, stdev=19552.16
     lat (usec): min=1566, max=122806, avg=45028.92, stdev=19553.50
    clat percentiles (msec):
     |  1.00th=[    5],  5.00th=[   12], 10.00th=[   22], 20.00th=[   44],
     | 30.00th=[   44], 40.00th=[   44], 50.00th=[   44], 60.00th=[   44],
     | 70.00th=[   45], 80.00th=[   46], 90.00th=[   66], 95.00th=[   77],
     | 99.00th=[  120], 99.50th=[  122], 99.90th=[  123], 99.95th=[  124],
     | 99.99th=[  124]
  write: IOPS=1838, BW=1838MiB/s (1928MB/s)(1024MiB/557msec); 0 zone resets
    slat (usec): min=230, max=4785, avg=296.13, stdev=147.93
    clat (msec): min=43, max=127, avg=66.63, stdev=14.39
     lat (msec): min=43, max=127, avg=66.93, stdev=14.37
    clat percentiles (msec):
     |  1.00th=[   44],  5.00th=[   46], 10.00th=[   48], 20.00th=[   64],
     | 30.00th=[   66], 40.00th=[   66], 50.00th=[   66], 60.00th=[   66],
     | 70.00th=[   66], 80.00th=[   70], 90.00th=[   75], 95.00th=[  102],
     | 99.00th=[  123], 99.50th=[  126], 99.90th=[  128], 99.95th=[  128],
     | 99.99th=[  128]
   bw (  MiB/s): min= 1794, max= 1794, per=97.58%, avg=1794.00, stdev= 0.00, samples=1
   iops        : min= 1794, max= 1794, avg=1794.00, stdev= 0.00, samples=1
  lat (msec)   : 2=0.10%, 4=0.29%, 10=1.56%, 20=2.73%, 50=42.19%
  lat (msec)   : 100=48.73%, 250=4.39%
  cpu          : usr=47.28%, sys=1.28%, ctx=1615, majf=0, minf=38
  IO depths    : 1=0.1%, 2=0.2%, 4=0.4%, 8=0.8%, 16=1.6%, 32=3.1%, >=64=93.8%
     submit    : 0=0.0%, 4=100.0%, 8=0.0%, 16=0.0%, 32=0.0%, 64=0.0%, >=64=0.0%
     complete  : 0=0.0%, 4=99.9%, 8=0.0%, 16=0.0%, 32=0.0%, 64=0.0%, >=64=0.1%
     issued rwts: total=1024,1024,0,0 short=0,0,0,0 dropped=0,0,0,0
     latency   : target=0, window=0, percentile=100.00%, depth=128

Run status group 0 (all jobs):
   READ: bw=2688MiB/s (2818MB/s), 2688MiB/s-2688MiB/s (2818MB/s-2818MB/s), io=1024MiB (1074MB), run=381-381msec
  WRITE: bw=1838MiB/s (1928MB/s), 1838MiB/s-1838MiB/s (1928MB/s-1928MB/s), io=1024MiB (1074MB), run=557-557msec

Disk stats (read/write):
  nvme0n1: ios=7160/8192, sectors=1820272/2097152, merge=0/0, ticks=283025/504352, in_queue=787378, util=87.17%

PCT测试结果 - 第2轮
测试开始时间: 2026-02-02 17:11:31
SSD路径: /dev/nvme0n1
SSD SN: 202505202T9002
SSD链路状态: LnkSta:	Speed 8GT/s, Width x4

============================================================
SMART信息:
============================================================
Smart Log for NVME device:nvme0n1 namespace-id:ffffffff
critical_warning			: 0
temperature				: 27 °C (300 K, 80 °F)
available_spare				: 100%
available_spare_threshold		: 10%
percentage_used				: 1%
endurance group critical warning summary: 0
Data Units Read				: 42809344 (21.92 TB)
Data Units Written			: 61853372 (31.67 TB)
host_read_commands			: 380519739
host_write_commands			: 482459502
controller_busy_time			: 399
power_cycles				: 570
power_on_hours				: 60
unsafe_shutdowns			: 139
media_errors				: 0
num_err_log_entries			: 0
Warning Temperature Time		: 0
Critical Composite Temperature Time	: 0
Temperature Sensor 1			: 27 °C (300 K, 80 °F)
Temperature Sensor 2			: 27 °C (300 K, 80 °F)
Temperature Sensor 4			: 35 °C (308 K, 95 °F)
Temperature Sensor 5			: 115 °C (388 K, 239 °F)
Thermal Management T1 Trans Count	: 0
Thermal Management T2 Trans Count	: 0
Thermal Management T1 Total Time	: 131072
Thermal Management T2 Total Time	: 11667856


============================================================
FIO执行命令: fio --ioengine=libaio --bs=1M --iodepth=128 --numjobs=1 --direct=1 --name=test --rw=write --filename=/dev/nvme0n1 --verify=crc32c --do_verify=1 --group_reporting --size=1G

============================================================
FIO输出:
============================================================
test: (g=0): rw=write, bs=(R) 1024KiB-1024KiB, (W) 1024KiB-1024KiB, (T) 1024KiB-1024KiB, ioengine=libaio, iodepth=128
fio-3.36
Starting 1 process

test: (groupid=0, jobs=1): err= 0: pid=33872: Mon Feb  2 04:11:47 2026
  read: IOPS=2625, BW=2626MiB/s (2753MB/s)(1024MiB/390msec)
    slat (usec): min=4, max=553, avg= 9.20, stdev=17.26
    clat (usec): min=1479, max=87209, avg=46256.38, stdev=13695.99
     lat (usec): min=1505, max=87245, avg=46265.58, stdev=13696.03
    clat percentiles (usec):
     |  1.00th=[ 5211],  5.00th=[18482], 10.00th=[35914], 20.00th=[43779],
     | 30.00th=[43779], 40.00th=[43779], 50.00th=[43779], 60.00th=[44303],
     | 70.00th=[44303], 80.00th=[58983], 90.00th=[62129], 95.00th=[69731],
     | 99.00th=[83362], 99.50th=[85459], 99.90th=[86508], 99.95th=[87557],
     | 99.99th=[87557]
  write: IOPS=1896, BW=1896MiB/s (1988MB/s)(1024MiB/540msec); 0 zone resets
    slat (usec): min=219, max=4787, avg=292.77, stdev=147.49
    clat (msec): min=38, max=127, avg=64.37, stdev=16.36
     lat (msec): min=38, max=127, avg=64.66, stdev=16.35
    clat percentiles (msec):
     |  1.00th=[   39],  5.00th=[   41], 10.00th=[   43], 20.00th=[   48],
     | 30.00th=[   66], 40.00th=[   66], 50.00th=[   66], 60.00th=[   66],
     | 70.00th=[   66], 80.00th=[   70], 90.00th=[   75], 95.00th=[  102],
     | 99.00th=[  123], 99.50th=[  126], 99.90th=[  128], 99.95th=[  128],
     | 99.99th=[  128]
   bw (  MiB/s): min= 1794, max= 1794, per=94.61%, avg=1794.00, stdev= 0.00, samples=1
   iops        : min= 1794, max= 1794, avg=1794.00, stdev= 0.00, samples=1
  lat (msec)   : 2=0.10%, 4=0.20%, 10=0.98%, 20=1.46%, 50=45.95%
  lat (msec)   : 100=48.68%, 250=2.64%
  cpu          : usr=47.74%, sys=1.29%, ctx=1619, majf=0, minf=38
  IO depths    : 1=0.1%, 2=0.2%, 4=0.4%, 8=0.8%, 16=1.6%, 32=3.1%, >=64=93.8%
     submit    : 0=0.0%, 4=100.0%, 8=0.0%, 16=0.0%, 32=0.0%, 64=0.0%, >=64=0.0%
     complete  : 0=0.0%, 4=99.9%, 8=0.0%, 16=0.0%, 32=0.0%, 64=0.0%, >=64=0.1%
     issued rwts: total=1024,1024,0,0 short=0,0,0,0 dropped=0,0,0,0
     latency   : target=0, window=0, percentile=100.00%, depth=128

Run status group 0 (all jobs):
   READ: bw=2626MiB/s (2753MB/s), 2626MiB/s-2626MiB/s (2753MB/s-2753MB/s), io=1024MiB (1074MB), run=390-390msec
  WRITE: bw=1896MiB/s (1988MB/s), 1896MiB/s-1896MiB/s (1988MB/s-1988MB/s), io=1024MiB (1074MB), run=540-540msec

Disk stats (read/write):
  nvme0n1: ios=7285/8192, sectors=1843304/2097152, merge=0/0, ticks=310848/468847, in_queue=779696, util=87.58%

PCT测试结果 - 第3轮
测试开始时间: 2026-02-02 17:12:32
SSD路径: /dev/nvme0n1
SSD SN: 202505202T9002
SSD链路状态: LnkSta:	Speed 8GT/s, Width x4

============================================================
SMART信息:
============================================================
Smart Log for NVME device:nvme0n1 namespace-id:ffffffff
critical_warning			: 0
temperature				: 28 °C (301 K, 82 °F)
available_spare				: 100%
available_spare_threshold		: 10%
percentage_used				: 1%
endurance group critical warning summary: 0
Data Units Read				: 42811452 (21.92 TB)
Data Units Written			: 61855470 (31.67 TB)
host_read_commands			: 380528194
host_write_commands			: 482467694
controller_busy_time			: 399
power_cycles				: 571
power_on_hours				: 60
unsafe_shutdowns			: 139
media_errors				: 0
num_err_log_entries			: 0
Warning Temperature Time		: 0
Critical Composite Temperature Time	: 0
Temperature Sensor 1			: 28 °C (301 K, 82 °F)
Temperature Sensor 2			: 28 °C (301 K, 82 °F)
Temperature Sensor 4			: 37 °C (310 K, 98 °F)
Temperature Sensor 5			: 115 °C (388 K, 239 °F)
Thermal Management T1 Trans Count	: 0
Thermal Management T2 Trans Count	: 0
Thermal Management T1 Total Time	: 131072
Thermal Management T2 Total Time	: 11667856


============================================================
FIO执行命令: fio --ioengine=libaio --bs=1M --iodepth=128 --numjobs=1 --direct=1 --name=test --rw=write --filename=/dev/nvme0n1 --verify=crc32c --do_verify=1 --group_reporting --size=1G

============================================================
FIO输出:
============================================================
test: (g=0): rw=write, bs=(R) 1024KiB-1024KiB, (W) 1024KiB-1024KiB, (T) 1024KiB-1024KiB, ioengine=libaio, iodepth=128
fio-3.36
Starting 1 process

test: (groupid=0, jobs=1): err= 0: pid=33883: Mon Feb  2 04:12:48 2026
  read: IOPS=2632, BW=2632MiB/s (2760MB/s)(1024MiB/389msec)
    slat (nsec): min=4914, max=26998, avg=8665.87, stdev=2530.07
    clat (usec): min=1493, max=87358, avg=46275.77, stdev=13642.24
     lat (usec): min=1518, max=87374, avg=46284.43, stdev=13642.42
    clat percentiles (usec):
     |  1.00th=[ 5211],  5.00th=[18744], 10.00th=[35914], 20.00th=[43779],
     | 30.00th=[43779], 40.00th=[43779], 50.00th=[43779], 60.00th=[44303],
     | 70.00th=[44303], 80.00th=[58983], 90.00th=[62129], 95.00th=[69731],
     | 99.00th=[84411], 99.50th=[85459], 99.90th=[86508], 99.95th=[87557],
     | 99.99th=[87557]
  write: IOPS=1872, BW=1872MiB/s (1963MB/s)(1024MiB/547msec); 0 zone resets
    slat (usec): min=218, max=405, avg=293.19, stdev=48.93
    clat (msec): min=41, max=132, avg=65.10, stdev=16.73
     lat (msec): min=41, max=132, avg=65.39, stdev=16.71
    clat percentiles (msec):
     |  1.00th=[   42],  5.00th=[   45], 10.00th=[   47], 20.00th=[   50],
     | 30.00th=[   66], 40.00th=[   66], 50.00th=[   66], 60.00th=[   66],
     | 70.00th=[   66], 80.00th=[   66], 90.00th=[   81], 95.00th=[  107],
     | 99.00th=[  128], 99.50th=[  130], 99.90th=[  132], 99.95th=[  133],
     | 99.99th=[  133]
   bw (  MiB/s): min= 1794, max= 1794, per=95.83%, avg=1794.00, stdev= 0.00, samples=1
   iops        : min= 1794, max= 1794, avg=1794.00, stdev= 0.00, samples=1
  lat (msec)   : 2=0.10%, 4=0.20%, 10=0.98%, 20=1.42%, 50=45.65%
  lat (msec)   : 100=48.58%, 250=3.08%
  cpu          : usr=47.49%, sys=1.71%, ctx=1636, majf=0, minf=39
  IO depths    : 1=0.1%, 2=0.2%, 4=0.4%, 8=0.8%, 16=1.6%, 32=3.1%, >=64=93.8%
     submit    : 0=0.0%, 4=100.0%, 8=0.0%, 16=0.0%, 32=0.0%, 64=0.0%, >=64=0.0%
     complete  : 0=0.0%, 4=99.9%, 8=0.0%, 16=0.0%, 32=0.0%, 64=0.0%, >=64=0.1%
     issued rwts: total=1024,1024,0,0 short=0,0,0,0 dropped=0,0,0,0
     latency   : target=0, window=0, percentile=100.00%, depth=128

Run status group 0 (all jobs):
   READ: bw=2632MiB/s (2760MB/s), 2632MiB/s-2632MiB/s (2760MB/s-2760MB/s), io=1024MiB (1074MB), run=389-389msec
  WRITE: bw=1872MiB/s (1963MB/s), 1872MiB/s-1872MiB/s (1963MB/s-1963MB/s), io=1024MiB (1074MB), run=547-547msec

Disk stats (read/write):
  nvme0n1: ios=7114/8192, sectors=1799528/2097152, merge=0/0, ticks=303493/470814, in_queue=774308, util=87.47%

